{
  "schema_version": "0.2.1",
  "argus_id": "ENT-BD-NAVY",
  "record_type": "ENTITY",
  "canonical_name_or_title": "Bangladesh Navy",
  "status": "current_official_institution",
  "aliases": [],
  "related_argus_ids": ["ENT-BD-DGDP"],
  "relationships": [
    {"target_argus_id": "ENT-BD-DGDP", "relation_type": "procured_for_by", "evidence_refs": []}
  ],
  "evidence_refs": [
    {"source_system": "USER_PROVIDED_DGDP_NOTICE", "source_id": "file_00000000377c8208a0ee09a6a4b4bb9c", "source_locator": "tender_20261014114803.pdf", "title": "DGDP tender notice for Bangladesh Navy", "as_of": "2026-10-18", "claim_type": "FACT", "claim_condition": "CURRENT", "notes": "The uploaded notice states the listed items are for Bangladesh Navy."},
    {"source_system": "DGDP_PUBLIC_NAVY_WING", "source_id": "NAVY_WING", "source_locator": "https://www.dgdp.gov.bd/navy-wing", "title": "DGDP Navy Wing", "as_of": "2026-10-18", "claim_type": "FACT", "claim_condition": "CURRENT", "notes": "Official DGDP page states Navy Wing is the central procurement entity for Bangladesh Navy and procures Naval Headquarters operational requirements."}
  ],
  "external_refs": [{"external_id": "Buyer_Procuring_Entity:Bangladesh Navy", "system": "DTIF_DB001", "label": "Legacy entity reference"}],
  "information_classification": "internal",
  "revision": 2,
  "created_at": "2026-10-16T01:48:17+06:00",
  "updated_at": "2026-10-18T00:00:00+06:00",
  "attributes": {
    "country_code": "BD",
    "entity_type": "MILITARY_END_USER_SERVICE",
    "legacy_identity_preserved": true
  }
}
