{
  "schema_version": "0.2.1",
  "argus_id": "PROC-DAE-1318662",
  "record_type": "PROCUREMENT",
  "canonical_name_or_title": "Irrigation Equipment: LLP (Low Lift Pump) Set",
  "status": "closed_or_superseded_original_cycle",
  "aliases": ["1318662", "12.01.0000.981.07.005.26-143", "GD/DAE/CHAR-28"],
  "related_argus_ids": ["ENT-BD-MOA", "ENT-BD-DAE", "ENT-BD-DAE-CHAR-224385000-PE", "PRJ-BD-DAE-224385000", "PROC-DAE-CHAR28-R2"],
  "relationships": [
    {"target_argus_id": "PRJ-BD-DAE-224385000", "relation_type": "related_to", "evidence_refs": []},
    {"target_argus_id": "ENT-BD-DAE-CHAR-224385000-PE", "relation_type": "procured_by", "evidence_refs": []},
    {"target_argus_id": "PROC-DAE-CHAR28-R2", "relation_type": "probable_predecessor_of", "evidence_refs": []}
  ],
  "evidence_refs": [{"source_system": "USER_PROVIDED_EGP_NOTICE", "source_id": "file_000000000f0c820897de3855ac90cc4f", "source_locator": "TenderNotice (77).pdf", "title": "e-GP tender notice for Tender/Proposal ID 1318662", "as_of": "2026-10-18", "claim_type": "FACT", "claim_condition": "CURRENT", "notes": "Primary verified source for the original solicitation identifiers, procurement/funding fields, dates, commercial mechanics, lot data and inviting official."}],
  "external_refs": [
    {"system": "EGP_TENDER_PROPOSAL_ID", "external_id": "1318662", "label": "Tender/Proposal ID"},
    {"system": "EGP_INVITATION_REFERENCE", "external_id": "12.01.0000.981.07.005.26-143", "label": "Invitation Reference No."},
    {"system": "EGP_APP_ID", "external_id": "229930", "label": "APP ID"},
    {"system": "EGP_PROJECT_CODE", "external_id": "224385000", "label": "Project Code"},
    {"system": "EGP_PACKAGE_NO", "external_id": "GD/DAE/CHAR-28", "label": "Package No."}
  ],
  "information_classification": "internal",
  "revision": 1,
  "created_at": "2026-10-18T00:00:00+06:00",
  "updated_at": "2026-10-18T00:00:00+06:00",
  "attributes": {
    "underlying_requirement_id": "REQ-DAE-224385000-CHAR28-LLP",
    "cycle_sequence": 1,
    "solicitation_system_id": "1318662",
    "solicitation_reference_no": "12.01.0000.981.07.005.26-143",
    "app_id": "229930",
    "project_code": "224385000",
    "package_no": "GD/DAE/CHAR-28",
    "lot_no": "01",
    "lot_identification": "Irrigation Equipment: LLP (Low Lift Pump)",
    "procurement_nature": "GOODS",
    "procurement_type": "NCT",
    "event_type": "TENDER",
    "invitation_for": "TENDER_SINGLE_LOT",
    "procurement_method": "OTM",
    "budget_type": "DEVELOPMENT",
    "funding_source": "GOVERNMENT",
    "publication_at": "2026-08-20T15:00:00+06:00",
    "document_sale_end_at": "2026-09-13T13:00:00+06:00",
    "pre_tender_meeting_start_at": "2026-08-20T15:11:00+06:00",
    "pre_tender_meeting_end_at": "2026-08-30T09:38:00+06:00",
    "security_submission_deadline_at": "2026-09-13T14:30:00+06:00",
    "closing_at": "2026-09-13T15:30:00+06:00",
    "opening_at": "2026-09-13T15:30:00+06:00",
    "eligibility_raw": "As per TDS",
    "evaluation_type": "LOT_WISE",
    "document_availability": "PACKAGE_WISE",
    "document_fee_basis": "PACKAGE_WISE",
    "document_price_bdt": 5000,
    "payment_mode": "BANK",
    "tender_valid_until": "2027-01-11",
    "tender_security_valid_until": "2027-02-08",
    "tender_security_bdt": 3900000,
    "lot_location": "Project Area",
    "tentative_start_date": "2026-10-22",
    "tentative_completion_date": "2027-04-08",
    "procurement_state": "CLOSED_OR_SUPERSEDED",
    "historical_maturity": "I9",
    "sponsoring_ministry_entity_id": "ENT-BD-MOA",
    "organization_entity_id": "ENT-BD-DAE",
    "procuring_entity_id": "ENT-BD-DAE-CHAR-224385000-PE"
  }
}