{
  "schema_version": "0.2.1",
  "argus_id": "PROC-DAE-CHAR28-R2",
  "record_type": "PROCUREMENT",
  "canonical_name_or_title": "Irrigation Equipment: LLP (Low Lift Pump) Set — probable successor cycle",
  "status": "supported_successor_candidate_pending_official_verification",
  "aliases": ["12.01.0000.981.07.005.26-367", "GD/DAE/CHAR-28"],
  "related_argus_ids": ["ENT-BD-MOA", "ENT-BD-DAE", "ENT-BD-DAE-CHAR-224385000-PE", "PRJ-BD-DAE-224385000", "PROC-DAE-1318662"],
  "relationships": [
    {"target_argus_id": "PRJ-BD-DAE-224385000", "relation_type": "related_to", "evidence_refs": []},
    {"target_argus_id": "PROC-DAE-1318662", "relation_type": "probable_reissue_of", "evidence_refs": []}
  ],
  "evidence_refs": [
    {"source_system": "DGMARKET_PUBLIC_MIRROR", "source_id": "115875707", "source_locator": "https://lelang.dgmarket.com/tenders/np-notice.do?keywords=&noticeId=115875707", "title": "Irrigation Equipment: LLP (Low Lift Pump) Set", "as_of": "2026-10-18", "claim_type": "INFERENCE", "claim_condition": "CURRENT", "notes": "Public mirror reproduces a later notice with reference 12.01.0000.981.07.005.26-367, publication 2026-10-08, same project/PE/package/product context and deadline 2026-10-25. It is not treated as authoritative e-GP verification."},
    {"source_system": "TENDERBANGLADESH_PUBLIC_INDEX", "source_id": "GD/DAE/CHAR-28-20261008", "source_locator": "https://tenderbangladesh.com/all-tenders?page=4&tender_category_slug=machineries---equipment", "title": "GD/DAE/CHAR-28 Irrigation Equipment: LLP (Low Lift Pump)", "as_of": "2026-10-18", "claim_type": "INFERENCE", "claim_condition": "CURRENT", "notes": "Independent tender index shows the same package/product published 2026-10-08 with deadline/opening 2026-10-25, supporting a successor/reissue assessment."}
  ],
  "external_refs": [{"system": "PUBLIC_MIRROR_INVITATION_REFERENCE", "external_id": "12.01.0000.981.07.005.26-367", "label": "Successor invitation reference pending official verification"}],
  "information_classification": "internal",
  "revision": 1,
  "created_at": "2026-10-18T00:00:00+06:00",
  "updated_at": "2026-10-18T00:00:00+06:00",
  "attributes": {
    "underlying_requirement_id": "REQ-DAE-224385000-CHAR28-LLP",
    "cycle_sequence": 2,
    "solicitation_reference_no": "12.01.0000.981.07.005.26-367",
    "project_code": "224385000",
    "package_no": "GD/DAE/CHAR-28",
    "product_raw": "Irrigation Equipment: LLP (Low Lift Pump) Set",
    "procurement_nature": "GOODS",
    "procurement_type": "NCT",
    "procurement_method": "OTM",
    "publication_date": "2026-10-08",
    "closing_date": "2026-10-25",
    "predecessor_procurement_id": "PROC-DAE-1318662",
    "relationship_to_predecessor": "PROBABLE_REISSUE_OF",
    "retender_assessment": "SUPPORTED_PENDING_OFFICIAL_VERIFICATION",
    "same_underlying_requirement_confidence": "HIGH",
    "procurement_state": "PROBABLE_LIVE_RETENDER",
    "maturity": "I9",
    "maturity_assurance": "SUPPORTED",
    "sponsoring_ministry_entity_id": "ENT-BD-MOA",
    "organization_entity_id": "ENT-BD-DAE",
    "procuring_entity_id": "ENT-BD-DAE-CHAR-224385000-PE",
    "material_unknowns": [
      "Authoritative e-GP successor Tender/Proposal ID",
      "Successor APP ID",
      "Whether the official successor notice explicitly labels the event as re-tender/reissue",
      "Successor lot/security/document-price/validity details",
      "Detailed technical specification and TDS eligibility"
    ],
    "research_frontier": "Retrieve authoritative e-GP successor notice for reference 12.01.0000.981.07.005.26-367 and resolve its Tender/Proposal ID, APP ID and explicit re-tender status."
  }
}